{
  "$schema": "https://json-schema.org/draft/2020-12/schema",
  "$id": "https://daily-it-podcast.local/generator/entities/models/writer_output.schema.json",
  "title": "WriterOutput",
  "description": "TextWriter 成功戻り string の JSON wire 形。完成 manuscript.schema.json ではない途中型。件数・文字数・日本語含有は Domain 検証の正本。",
  "type": "object",
  "additionalProperties": false,
  "required": ["title", "intro", "topics", "closingSummary"],
  "properties": {
    "title": {
      "type": "string"
    },
    "intro": {
      "type": "string"
    },
    "topics": {
      "type": "array",
      "items": {
        "type": "object",
        "additionalProperties": false,
        "required": ["title", "preface", "detail"],
        "properties": {
          "title": {
            "type": "string"
          },
          "preface": {
            "type": "string"
          },
          "detail": {
            "type": "string"
          }
        }
      }
    },
    "closingSummary": {
      "type": "string"
    }
  }
}
