{
  "title": "マイクロソフトがRustをC++やC#・TypeScriptと並ぶ社内Tier1言語に据えた",
  "intro": "本日は五つの話題を取り上げます。マイクロソフトがRustをシーやシーシャープ、TypeScriptと並ぶ社内のTier1言語にした発表、SnowflakeがGoogle Cloudの東京リージョン対応を二〇二六年度第四四半期に予定した件、Tailwind CSSの開発元がShopifyに買収される件、Signalが電話番号なしの登録にゼロ知識証明を使う構想、そして配列操作のreduceが読みにくいという議論です。",
  "topics": [
    {
      "title": "マイクロソフトがRustをTier1に",
      "preface": "最初の話題は、マイクロソフトが社内開発でRustをシープラスプラスやシーシャープ、TypeScriptと同列の最上位言語に位置づけたという発表です。Rust Foundation向けのGuest PostでVictor Ciura氏が示し、Windowsネイティブな社内ツールチェーンとの統合が前提だと書かれています。安全なツールチェーンやビルド、開発環境まで標準セットに入るという意味を、発表の文面から押さえます。",
      "detail": "Victor Ciura氏はRustツールチームのプリンシパルエンジニアとして、記事Rust Is Tier-1 Language at Microsoftで社内の位置づけを公表しました。PublicKeyの報道でも、シーやシーシャープ、TypeScriptとの並列が強調されています。ここで言うTier1は、安全なツールチェーン、ビルド、開発環境、ワークフローまで標準の選択肢に入るという意味合いです。Windowsネイティブな社内開発環境と結びつけることで、既存のシーやシープラスプラス資産を捨てずに段階的に寄せる道筋が示されています。メモリ安全性をコンパイラと型で担保する言語が、巨大企業の正式な候補になった点が大きいです。一方で学習コストや相互運用の設計は残るため、全面置き換えではなく標準化と教育が次の論点として残ります。Rust採用をめぐる賛否では、メモリ安全を唯一の正解とみなすか、トレードオフとして扱うかの温度差が見えます。チームに降りてくるのは、採用基準を文書化し、既存コードとの境界を決める作業です。新卒やインターンが触るリポジトリでRustが選択肢に入るかは、各チームのガイドライン次第になります。発表時点で確定しているのは、社内の標準言語セットにRustが並んだという事実です。"
    },
    {
      "title": "SnowflakeがGCP東京を支援",
      "preface": "二つ目はデータ基盤の話題です。Snowflake合同会社は、Google Cloudの東京リージョンでSnowflakeのサポートを二〇二六年度第四四半期、つまり二〇二六年十一月から二〇二七年一月の枠で開始する予定だと発表しました。分析データを国内に置きたい組織にとって、いつから東京を選べるかがロードマップの分岐点になります。Cloud Watch経由の報道でも、国内管理の選択肢が広がる点が強調されています。",
      "detail": "発表によると、Google Cloud東京リージョンでのサポート開始が二〇二六年度第四四半期に予定されています。これにより、日本国内のリージョンにデータを置きたい組織が、Snowflakeの利用モデルを大きく変えずに配置を選べる余地が増えます。契約や監査でデータ所在地が問われる現場では、リージョン追加そのものが要件充足に直結することが多いです。金融や公共系の検討では、公表された四四半期が切り替え可能になる目安になります。ただし開始前は既存リージョン運用が続くため、移行計画はその時期を前提に組む必要があります。料金、レイテンシ、他クラウドとの接続も比較対象であり、東京が使えるからといって自動的に最適とは限りません。マルチクラウドでSnowflakeを使っている場合は、東京追加後のデータフローと課金モデルをシミュレーションしておくと後悔が少ないです。データガバナンス担当とエンジニアが同じ表を見ながら、切り替え可能になる時期を共有するのが現実的です。発表段階で確かなのは、国内管理の選択肢が増える方向性と、具体的な開始時期の目安です。検討チームの最初の一歩は、既存ワークロードのデータ所在とコンプライアンス条件を照合することです。リージョン追加後も、既存ワークロードのデータ分類表を更新し、どのデータセットを東京へ移すかを先に決める必要があります。"
    },
    {
      "title": "TailwindがShopifyに参加",
      "preface": "三つ目はフロントエンド周辺の企業ニュースです。ユーティリティ優先のシーエスエスフレームワークTailwind CSSの開発元Tailwind Labsが、イーシー基盤のShopifyによる買収を発表しました。作者Adam Wathan氏はソーシャルでBig one todayと述べ、Tailwind is joining Shopifyと明示しています。人気オープンソースの持続性と、買収後の開発継続方針が論点です。",
      "detail": "Tailwindシーエスエスはクラス名でスタイルを組み立てる方式で、個人サイトから大規模プロダクトまで広く採用されています。今回の買収は、フレームワーク単体の収益と体制維持が難しくなっていた背景が記事でも触れられており、利用者が増えても運営側の持続が課題になり得る例として読めます。Shopifyはイーシープラットフォームとしてフロントエンド投資を続けており、Tailwindを取り込むことでデザインシステムと実装速度を揃えたい意図がうかがえます。発表では今後も安定的な開発を維持する方針が示されており、利用を直ちに止める話ではありません。依存度が高いチームは、リリースノートとライセンス、ロードマップの変化を定期的に見る必要は残ります。人気ライブラリでもビジネスモデルとオーナーが技術選択に効くことを押さえるのがよいです。PublicKeyの見出しが示すように、エーアイ時代の収益構造と人員削減の話が背景にあり、技術だけでは説明しきれない側面もあります。既存プロジェクトでは、バージョン固定とビルドパイプラインの再現性を先に固め、方針変更が出ても差分を吸収できる状態を作るのが堅いです。Shopify側の製品ロードマップとTailwindの互換性ポリシーがどう連動するかは、今後のリリースで確認する領域です。"
    },
    {
      "title": "Signalの電話番号なし登録とZKP",
      "preface": "四つ目はメッセージアプリSignalの登録方式です。電話番号を使わない登録にゼロ知識証明を用いる方向が話題になり、プライバシーとスパム対策、実装コストが交差しています。Google Play Billingや、シムのないAndroidタブレットを付属端末として扱える改善も並行して語られ、賛否の線引きをソースに書かれた論点から押さえます。番号レス登録そのものと、端末まわりの改善は別線で進んでいる点も、論点を混ぜないために重要です。",
      "detail": "議論の中心は、電話番号という強い識別子を要求しない登録を、ゼロ知識証明でどう実現するかです。支持する側は、シムや番号拘束から離れることで監視や番号喪失のリスクを下げられると評価します。慎重な側は、証明系の複雑さ、クライアント負荷、スパム対策を番号以外でどう担保するかを問題にします。スパマーが十セント程度で番号を買える現実と比べ、証明コストが抑止に足るかという経済的な問いも出ています。非営利団体としてインフラ自動化を公開すべきだという要求は、透明性と再構築可能性の観点から繰り返し見られます。ゼロ知識証明とは別線で、シムのないAndroidタブレットを正規の付属端末として扱えるリリース周期の改善も喜ばれています。ゼロ知識証明は何を隠したまま何を示すかを一文で説明できると、賛否の論点が整理しやすくなります。ソースに明示された主張と、評価者の感想を分けて読む必要があります。実装の速度と透明性そのものを評価軸にしている参加者もおり、機能説明だけで終わらない議論になっています。登録フローを設計する側は、ユーザー体験と悪用耐性の両方を同じ表で比較する必要があります。端末の付属シム要件が緩む改善は、番号レス登録の議論と独立に追う価値があります。"
    },
    {
      "title": "reduceが読みにくいと言われる理由",
      "preface": "最後は日々のコーディング感覚に近い議論です。Evan Hahnの記事を起点に、配列処理のreduceが嫌われがちな理由が長く語られています。mapやfilterは役割が狭いのに対し、reduceは畳み込み次第で合計から構造変換まで書けるため、読み手の予測が広がるという指摘が多く見られます。injectやaccumulateといった別名の比較も交わされています。",
      "detail": "reduceは関数型のリスト操作の中で最も汎用的であり、型理論では他の操作を表現できるほど強いと説明されることがあります。mapは要素変換、filterは抽出と意図が読み取りやすい一方、reduceは初期値と結合関数の選択で意味が大きく変わります。そのためレビューで何をしているか追うコストが上がり、sumやallなど名前付きの畳み込みへ置き換える提案が出ます。反論では、forループはさらに表現力が広いので、慣れ親しんだループとreduceの読みやすさは別問題だという整理もあります。Fennelではaccumulateという名前を採用した例も引用され、reduceという語が意図を伝えにくいという感覚が共有されています。学習段階では、まずmapとfilterで足りるかを考え、足りないときだけreduceか明示ループを選ぶ順番が実務的です。好みの話に見えても、チームの可読性契約と密接に結びついています。シープラスプラスのstd::accumulateやRubyのeach_with_objectなど、言語ごとの名前の違いも比較材料になっています。表現力が高い抽象は短く書ける一方、読み手が抱える可能性の空間が広がるというトレードオフを、コードレビューの言葉で共有できると議論が建設的になります。"
    }
  ],
  "closingSummary": "本日は、マイクロソフトによるRustの社内Tier1化、Snowflakeの東京リージョン予定、Tailwind LabsのShopify買収、Signalの電話番号なし登録構想、reduceの可読性をめぐる議論を取り上げました。言語の標準セット、データの置き場所、人気ライブラリのオーナー、登録の識別子、配列操作の抽象度まで、設計の前提が動く話が並んでいます。自分のプロジェクトに効く箇所から、発表内容と議論の要点を順に追うと整理しやすいです。"
}
